{
  "insight_id": "ins_0001",
  "match_id": "m_demo_01",
  "clock": { "start_sec": 3120, "duration_sec": 12, "emitted_latency_ms": 840 },
  "insight_type": "perimeter_lock",
  "teams": { "primary": "NOR", "secondary": "AUR" },
  "player_ids": [],
  "claim_id": "clm_0002",
  "evidence_event_ids": ["e_004100", "e_004103", "e_004107"],
  "verification_status": "published_with_context",
  "context_chip": { "standard_metric": "field_tilt", "standard_value": 78, "note_key": "field_tilt.trailing_vs_deep_block" },
  "payload": {
    "focus": { "x_min": 60, "x_max": 100, "y_min": 0, "y_max": 100 },
    "points": [
      { "event_id": "e_004100", "x": 72, "y": 20, "x_end": 74, "y_end": 48, "kind": "pass" },
      { "event_id": "e_004103", "x": 74, "y": 48, "x_end": 71, "y_end": 80, "kind": "pass" }
    ],
    "metrics": { "passes_outside_box": 31, "box_entries": 1 },
    "confidence": "medium"
  },
  "text": {
    "template_key": "perimeter_lock.trailing",
    "params": { "team": "NOR", "passes_outside_box": 31, "box_entries": 1 },
    "rendered": {
      "en": {
        "analyst": "NOR hold 78% field tilt, but 31 final-third passes stayed outside the box for 1 entry.",
        "casual": "NOR have the ball a lot near the goal, but only got into the box once."
      }
    },
    "number_guard_passed": true
  }
}
